{
  "sessionId": "audit-20251020",
  "createdAt": "2025-10-20T16:32:41.252Z",
  "updatedAt": "2025-10-20T16:32:41.252Z",
  "user": {
    "id": "user-1"
  },
  "messages": [
    {
      "role": "agent",
      "content": "Completed comprehensive project audit. Verified all 28 README files, 10 documentation files, 4 automation tools, and conversation tracking system. Created AUDIT-REPORT.md with full verification. All systems operational. Committed as 894ff050 and pushed to remote.",
      "timestamp": "2025-10-20T16:32:41.252Z"
    }
  ],
  "metadata": {
    "project": "angular-dev"
  }
}